{
  "run_id": "run_010_2026-10-01",
  "taxonomy_version": "0.2.3",
  "mapping_version": "0.2.4",
  "dataset": "/Users/zihao_/Documents/coding/dataset/original/L6 M2_LS6 M3 产品专家门店支持信息收集汇总_产品专家支持每日反馈_收集结果.csv",
  "record_count": 12,
  "coding_count": 253,
  "scope": {
    "product_experts": [
      "林鑫",
      "王昊东",
      "郭能能",
      "周正成",
      "李文涛",
      "方园园",
      "汪翔",
      "季佳佳",
      "张耀文",
      "胡然",
      "陈雅萍",
      "陆宣妤"
    ],
    "city_stores": [
      "重庆·重庆南岸服务中心",
      "遵义·播州用户中心",
      "万州·万达广场快闪",
      "重庆·南坪金菱车世界店",
      "重庆·重庆金菱车世界车城店",
      "贵阳·贵阳万象汇",
      "重庆·龙湖时代天街体验中心",
      "重庆·重庆礼嘉天街体验中心",
      "重庆·新光里商超店",
      "遵义·吾悦广场慢闪",
      "贵阳·悦然时光店",
      "贵阳·悦然时光"
    ],
    "support_periods": [
      {
        "raw": "2026/10/01",
        "start_date": "2026-10-01",
        "end_date": "2026-10-01"
      }
    ],
    "window": "10/01"
  },
  "records": [
    {
      "record_index": 0,
      "submission_id": "63",
      "submitter": "林鑫",
      "expert": "林鑫",
      "city": "重庆",
      "store": "重庆南岸服务中心",
      "support_date": "2026/10/01",
      "support_date_iso": "2026-10-01"
    },
    {
      "record_index": 1,
      "submission_id": "64",
      "submitter": "王昊东",
      "expert": "王昊东",
      "city": "遵义",
      "store": "播州用户中心",
      "support_date": "2026/10/01",
      "support_date_iso": "2026-10-01"
    },
    {
      "record_index": 2,
      "submission_id": "65",
      "submitter": "郭能能",
      "expert": "郭能能",
      "city": "万州",
      "store": "万达广场快闪",
      "support_date": "2026/10/01",
      "support_date_iso": "2026-10-01"
    },
    {
      "record_index": 3,
      "submission_id": "66",
      "submitter": "周正成",
      "expert": "周正成",
      "city": "重庆",
      "store": "南坪金菱车世界店",
      "support_date": "2026/10/01",
      "support_date_iso": "2026-10-01"
    },
    {
      "record_index": 4,
      "submission_id": "67",
      "submitter": "李文涛",
      "expert": "李文涛",
      "city": "重庆",
      "store": "重庆金菱车世界车城店",
      "support_date": "2026/10/01",
      "support_date_iso": "2026-10-01"
    },
    {
      "record_index": 5,
      "submission_id": "68",
      "submitter": "方园园",
      "expert": "方园园",
      "city": "贵阳",
      "store": "贵阳万象汇",
      "support_date": "2026/10/01",
      "support_date_iso": "2026-10-01"
    },
    {
      "record_index": 6,
      "submission_id": "69",
      "submitter": "汪翔",
      "expert": "汪翔",
      "city": "重庆",
      "store": "龙湖时代天街体验中心",
      "support_date": "2026/10/01",
      "support_date_iso": "2026-10-01"
    },
    {
      "record_index": 7,
      "submission_id": "70",
      "submitter": "季佳佳",
      "expert": "季佳佳",
      "city": "重庆",
      "store": "重庆礼嘉天街体验中心",
      "support_date": "2026/10/01",
      "support_date_iso": "2026-10-01"
    },
    {
      "record_index": 8,
      "submission_id": "71",
      "submitter": "张耀文",
      "expert": "张耀文",
      "city": "重庆",
      "store": "新光里商超店",
      "support_date": "2026/10/01",
      "support_date_iso": "2026-10-01"
    },
    {
      "record_index": 9,
      "submission_id": "72",
      "submitter": "胡然",
      "expert": "胡然",
      "city": "遵义",
      "store": "吾悦广场慢闪",
      "support_date": "2026/10/01",
      "support_date_iso": "2026-10-01"
    },
    {
      "record_index": 10,
      "submission_id": "73",
      "submitter": "陈雅萍",
      "expert": "陈雅萍",
      "city": "贵阳",
      "store": "悦然时光店",
      "support_date": "2026/10/01",
      "support_date_iso": "2026-10-01"
    },
    {
      "record_index": 11,
      "submission_id": "74",
      "submitter": "陆宣妤",
      "expert": "陆宣妤",
      "city": "贵阳",
      "store": "悦然时光",
      "support_date": "2026/10/01",
      "support_date_iso": "2026-10-01"
    }
  ],
  "store_ops": {
    "records": [
      {
        "record_index": 0,
        "expert": "林鑫",
        "store": "重庆南岸服务中心",
        "support_date": "2026/10/01",
        "items": [
          {
            "code": "footfall",
            "label": "客流组数",
            "quote": "6-8"
          },
          {
            "code": "footfall_trend",
            "label": "客流相比往常",
            "quote": "较以往稍多"
          },
          {
            "code": "ls6_attention_share",
            "label": "关注LS6客户占比",
            "quote": "50%"
          },
          {
            "code": "peak_hours",
            "label": "客流高峰时段",
            "quote": "13.30-16.30"
          }
        ]
      },
      {
        "record_index": 1,
        "expert": "王昊东",
        "store": "播州用户中心",
        "support_date": "2026/10/01",
        "items": [
          {
            "code": "footfall",
            "label": "客流组数",
            "quote": "9-11"
          },
          {
            "code": "footfall_trend",
            "label": "客流相比往常",
            "quote": "与以往相当"
          },
          {
            "code": "ls6_attention_share",
            "label": "关注LS6客户占比",
            "quote": "50%"
          },
          {
            "code": "peak_hours",
            "label": "客流高峰时段",
            "quote": "13.30-16.30"
          }
        ]
      },
      {
        "record_index": 2,
        "expert": "郭能能",
        "store": "万达广场快闪",
        "support_date": "2026/10/01",
        "items": [
          {
            "code": "footfall",
            "label": "客流组数",
            "quote": "32以上"
          },
          {
            "code": "footfall_trend",
            "label": "客流相比往常",
            "quote": "较以往明显更多"
          },
          {
            "code": "ls6_attention_share",
            "label": "关注LS6客户占比",
            "quote": "100%"
          },
          {
            "code": "peak_hours",
            "label": "客流高峰时段",
            "quote": "13.30-16.30"
          }
        ]
      },
      {
        "record_index": 3,
        "expert": "周正成",
        "store": "南坪金菱车世界店",
        "support_date": "2026/10/01",
        "items": [
          {
            "code": "footfall",
            "label": "客流组数",
            "quote": "9-11"
          },
          {
            "code": "footfall_trend",
            "label": "客流相比往常",
            "quote": "较以往稍多"
          },
          {
            "code": "ls6_attention_share",
            "label": "关注LS6客户占比",
            "quote": "60%"
          },
          {
            "code": "peak_hours",
            "label": "客流高峰时段",
            "quote": "13.30-16.30"
          }
        ]
      },
      {
        "record_index": 4,
        "expert": "李文涛",
        "store": "重庆金菱车世界车城店",
        "support_date": "2026/10/01",
        "items": [
          {
            "code": "footfall",
            "label": "客流组数",
            "quote": "9-11"
          },
          {
            "code": "footfall_trend",
            "label": "客流相比往常",
            "quote": "较以往稍多"
          },
          {
            "code": "ls6_attention_share",
            "label": "关注LS6客户占比",
            "quote": "60%"
          },
          {
            "code": "peak_hours",
            "label": "客流高峰时段",
            "quote": "13.30-16.30"
          }
        ]
      },
      {
        "record_index": 5,
        "expert": "方园园",
        "store": "贵阳万象汇",
        "support_date": "2026/10/01",
        "items": [
          {
            "code": "footfall",
            "label": "客流组数",
            "quote": "6-8"
          },
          {
            "code": "footfall_trend",
            "label": "客流相比往常",
            "quote": "与以往相当"
          },
          {
            "code": "ls6_attention_share",
            "label": "关注LS6客户占比",
            "quote": "30%"
          },
          {
            "code": "peak_hours",
            "label": "客流高峰时段",
            "quote": "13.30-16.30"
          }
        ]
      },
      {
        "record_index": 6,
        "expert": "汪翔",
        "store": "龙湖时代天街体验中心",
        "support_date": "2026/10/01",
        "items": [
          {
            "code": "footfall",
            "label": "客流组数",
            "quote": "23-27"
          },
          {
            "code": "footfall_trend",
            "label": "客流相比往常",
            "quote": "与以往相当"
          },
          {
            "code": "ls6_attention_share",
            "label": "关注LS6客户占比",
            "quote": "60%"
          },
          {
            "code": "peak_hours",
            "label": "客流高峰时段",
            "quote": "16.30-19.00"
          }
        ]
      },
      {
        "record_index": 7,
        "expert": "季佳佳",
        "store": "重庆礼嘉天街体验中心",
        "support_date": "2026/10/01",
        "items": [
          {
            "code": "footfall",
            "label": "客流组数",
            "quote": "16-18"
          },
          {
            "code": "footfall_trend",
            "label": "客流相比往常",
            "quote": "较以往稍少"
          },
          {
            "code": "ls6_attention_share",
            "label": "关注LS6客户占比",
            "quote": "80%"
          },
          {
            "code": "peak_hours",
            "label": "客流高峰时段",
            "quote": "13.30-16.30"
          }
        ]
      },
      {
        "record_index": 8,
        "expert": "张耀文",
        "store": "新光里商超店",
        "support_date": "2026/10/01",
        "items": [
          {
            "code": "footfall",
            "label": "客流组数",
            "quote": "6-8"
          },
          {
            "code": "footfall_trend",
            "label": "客流相比往常",
            "quote": "较以往稍少"
          },
          {
            "code": "ls6_attention_share",
            "label": "关注LS6客户占比",
            "quote": "70%"
          },
          {
            "code": "peak_hours",
            "label": "客流高峰时段",
            "quote": "13.30-16.30"
          }
        ]
      },
      {
        "record_index": 9,
        "expert": "胡然",
        "store": "吾悦广场慢闪",
        "support_date": "2026/10/01",
        "items": [
          {
            "code": "footfall",
            "label": "客流组数",
            "quote": "23-27"
          },
          {
            "code": "footfall_trend",